{
  "$schema": "../../schema/pack.schema.json",
  "schemaVersion": 1,
  "id": "my-semester",
  "title": "Mein Semester",
  "semester": { "label": "", "start": "2026-10-12", "end": "2027-02-19" },
  "settings": {
    "reviewLadder": [1, 3, 7, 14, 21, 35, 60],
    "skipWeekends": true,
    "questionsPerQuiz": 5,
    "language": "de"
  },
  "subjects": ["example"],
  "dojos": []
}
