{
  "$schema": "../../schema/pack.schema.json",
  "schemaVersion": 1,
  "id": "demo",
  "title": "Demo semester",
  "description": "Example with two subjects. The app shifts all dates relative to today when it loads the demo.",
  "semester": { "label": "Winter 2026/27", "start": "2026-10-12", "end": "2027-02-19" },
  "settings": { "reviewLadder": [1, 3, 7, 14, 21, 35, 60], "skipWeekends": true, "questionsPerQuiz": 5, "language": "en" },
  "subjects": ["theo", "db"],
  "dojos": ["theo-nfa-dfa", "theo-regex-nfa", "theo-dfa-regex", "theo-minimize", "db-sql", "db-relalg"]
}
